{
  "$schema": "http://json-schema.org/draft-07/schema#",
  "title": "StorageListResponse",
  "type": "object",
  "required": ["correlation_id", "status", "items"],
  "properties": {
    "correlation_id": { "type": "string" },
    "status": { "type": "string", "enum": ["ok", "error"] },
    "items": {
      "type": "array",
      "items": {
        "type": "object",
        "required": ["key", "size_bytes", "updated_at"],
        "properties": {
          "key": { "type": "string" },
          "size_bytes": { "type": "integer" },
          "etag": { "type": "string" },
          "url": { "type": "string", "format": "uri" },
          "updated_at": { "type": "string", "format": "date-time" }
        },
        "additionalProperties": false
      }
    },
    "next_cursor": { "type": ["string", "null"] },
    "error": { "$ref": "./errors.json#/definitions/StorageError" }
  },
  "additionalProperties": false
}
